<?xml version="1.0" encoding="UTF-8"?>
<phyloxml xmlns:xsi="http://www.w3.org/2001/XMLSchema-instance"
   xsi:schemaLocation="http://www.phyloxml.org http://www.phyloxml.org/1.00/phyloxml.xsd"
   xmlns="http://www.phyloxml.org">
   <phylogeny rooted="true" rerootable="false">
      <clade>
         <name>cellular_organisms</name>
         <clade>
            <name>Bacteria</name>
            <reference doi="10.1101/gr.187002"/>
            <clade>
               <name>Spirochaetes</name>
               <clade>
                  <name>BORBU</name>
               </clade>
               <clade>
                  <name>TREPA</name>
               </clade>
            </clade>
            <clade>
               <name>b_1</name>
               <clade>
                  <name>Chlamydiales</name>
                  <clade>
                     <name>CHLFF</name>
                  </clade>
                  <clade>
                     <name>Chlamydia</name>
                     <clade>
                        <name>CHLMU</name>
                     </clade>
                     <clade>
                        <name>CHLPN</name>
                     </clade>
                  </clade>
               </clade>
               <clade>
                  <name>b_2</name>
                  <clade>
                     <name>hyperthermophilic</name>
                     <clade>
                        <name>AQUAE</name>
                     </clade>
                     <clade>
                        <name>THEMA</name>
                     </clade>
                  </clade>
                  <clade>
                     <name>b_3</name>
                     <clade>
                        <name>Proteobacteria</name>
                        <clade>
                           <name>Epsilonproteobacteria</name>
                           <clade>
                              <name>NITSB</name>
                           </clade>
                           <clade>
                              <name>Campylobacterales</name>
                              <clade>
                                 <name>HELPH</name>
                              </clade>
                              <clade>
                                 <name>CAMJE</name>
                              </clade>
                           </clade>
                        </clade>
                        <clade>
                           <name>b_5</name>
                           <clade>
                              <name>Alphaproteobacteria</name>
                              <clade>
                                 <name>RICTY</name>
                              </clade>
                              <clade>
                                 <name>CAUCR</name>
                              </clade>
                           </clade>
                           <clade>
                              <name>b_4</name>
                              <clade>
                                 <name>Betaproteobacteria</name>
                                 <clade>
                                    <name>NEIME</name>
                                 </clade>
                                 <clade>
                                    <name>RALME</name>
                                 </clade>
                              </clade>
                              <clade>
                                 <name>Gammaproteobacteria</name>
                                 <clade>
                                    <name>XYLFT</name>
                                 </clade>
                                 <clade>
                                    <name>b_6</name>
                                    <clade>
                                       <name>PSEAE</name>
                                    </clade>
                                    <clade>
                                       <name>b_7</name>
                                       <clade>
                                          <name>b_8</name>
                                          <clade>
                                             <name>ECOLI</name>
                                          </clade>
                                          <clade>
                                             <name>VIBCH</name>
                                          </clade>
                                       </clade>
                                       <clade>
                                          <name>Pasteurellales</name>
                                          <clade>
                                             <name>PASMU</name>
                                          </clade>
                                          <clade>
                                             <name>HAEIN</name>
                                          </clade>
                                       </clade>
                                    </clade>
                                 </clade>
                              </clade>
                           </clade>
                        </clade>
                     </clade>
                     <clade>
                        <name>b_9</name>
                        <clade>
                           <name>Firmicutes</name>
                           <clade>
                              <name>Mycoplasmataceae</name>
                              <clade>
                                 <name>UREPA</name>
                              </clade>
                              <clade>
                                 <name>Mycoplasma</name>
                                 <clade>
                                    <name>MYCPN</name>
                                 </clade>
                                 <clade>
                                    <name>MYCGE</name>
                                 </clade>
                              </clade>
                           </clade>
                           <clade>
                              <name>b_10</name>
                              <clade>
                                 <name>Lactobacillales</name>
                                 <clade>
                                    <name>STRPY</name>
                                 </clade>
                                 <clade>
                                    <name>LACLA</name>
                                 </clade>
                              </clade>
                              <clade>
                                 <name>Bacillales</name>
                                 <clade>
                                    <name>STAAU</name>
                                 </clade>
                                 <clade>
                                    <name>Bacillaceae</name>
                                    <clade>
                                       <name>BACSU</name>
                                    </clade>
                                    <clade>
                                       <name>BACHD</name>
                                    </clade>
                                 </clade>
                              </clade>
                           </clade>
                        </clade>
                        <clade>
                           <name>b_11</name>
                           <clade>
                              <name>Cyanobacteria</name>
                              <clade>
                                 <name>Synechococcus</name>
                                 <clade>
                                    <name>SYNEL</name>
                                 </clade>
                                 <clade>
                                    <name>SYNS3</name>
                                 </clade>
                              </clade>
                              <clade>
                                 <name>Nostocaceae</name>
                                 <clade>
                                    <name>NOSS7</name>
                                 </clade>
                                 <clade>
                                    <name>ANAVA</name>
                                 </clade>
                              </clade>
                           </clade>
                           <clade>
                              <name>b_12</name>
                              <clade>
                                 <name>DEIRA</name>
                              </clade>
                              <clade>
                                 <name>Actinobacteria</name>
                                 <clade>
                                    <name>STRCO</name>
                                 </clade>
                                 <clade>
                                    <name>Mycobacterium</name>
                                    <clade>
                                       <name>MYCTU</name>
                                    </clade>
                                    <clade>
                                       <name>MYCLE</name>
                                    </clade>
                                 </clade>
                              </clade>
                           </clade>
                        </clade>
                     </clade>
                  </clade>
               </clade>
            </clade>
         </clade>
         <clade>
            <name>Archaea_Eukaryota</name>
            <clade>
               <name>Archaea</name>
               <reference doi="10.1186/1471-2164-8-86"/>
               <clade>
                  <name>Crenarchaeota</name>
                  <clade>
                     <name>PYRAE</name>
                  </clade>
                  <clade>
                     <name>a_14</name>
                     <clade>
                        <name>AERPE</name>
                     </clade>
                     <clade>
                        <name>a_15</name>
                        <clade>